{
  "claim_boundary": "sentence-level manuscript language audit; not empirical evidence",
  "ok": true,
  "risky_rows": [],
  "row_count": 114,
  "rows": [
    {
      "allowed": true,
      "blocked_domain_risky": false,
      "blocked_domains": [
        "realization",
        "clinical",
        "neural",
        "practice efficacy"
      ],
      "claim_target_terms": [
        "evidence",
        "practice"
      ],
      "file": "docs/manuscript/sections/abstract/limitations.md",
      "has_boundary_scope": false,
      "has_negation": false,
      "no_self_risky": false,
      "sentence": "A physical realization of the quantum free-energy principle, public independent reproduction, and any human practice efficacy, neural measurement, or clinical outcome remain blocked future evidence classes.",
      "strong_verbs": [],
      "unscoped_strong_claim": false
    },
    {
      "allowed": true,
      "blocked_domain_risky": false,
      "blocked_domains": [
        "realisation"
      ],
      "claim_target_terms": [
        "software",
        "artifact",
        "evidence",
        "no self",
        "self"
      ],
      "file": "docs/manuscript/sections/abstract/paper_source.md",
      "has_boundary_scope": true,
      "has_negation": false,
      "no_self_risky": false,
      "sentence": "This project operationalizes the 2026 preprint *There is no self-evidence: A physics of emptiness realisation* as a source-anchored software artifact [@sandvedsmith2026noself].",
      "strong_verbs": [],
      "unscoped_strong_claim": false
    },
    {
      "allowed": true,
      "blocked_domain_risky": false,
      "blocked_domains": [
        "physical qfep"
      ],
      "claim_target_terms": [
        "evidence",
        "qfep"
      ],
      "file": "docs/manuscript/sections/conclusion/README.md",
      "has_boundary_scope": true,
      "has_negation": true,
      "no_self_risky": false,
      "sentence": "md` - closes the implemented finite qFEP/quantum extension layer without crossing into physical qFEP evidence.",
      "strong_verbs": [],
      "unscoped_strong_claim": false
    },
    {
      "allowed": true,
      "blocked_domain_risky": false,
      "blocked_domains": [
        "awakening",
        "clinical",
        "neural"
      ],
      "claim_target_terms": [
        "qfep",
        "practice"
      ],
      "file": "docs/manuscript/sections/conclusion/README.md",
      "has_boundary_scope": false,
      "has_negation": false,
      "no_self_risky": false,
      "sentence": "md` - names the empirical, clinical, neural, awakening, practice, and physical-qFEP ceilings.",
      "strong_verbs": [],
      "unscoped_strong_claim": false
    },
    {
      "allowed": true,
      "blocked_domain_risky": false,
      "blocked_domains": [
        "neural"
      ],
      "claim_target_terms": [
        "software",
        "claim",
        "evidence",
        "boundary"
      ],
      "file": "docs/manuscript/sections/conclusion/evidence_ceiling.md",
      "has_boundary_scope": true,
      "has_negation": true,
      "no_self_risky": false,
      "sentence": "All of this is finite deterministic software validation against a declared evidence ceiling; none of it is evidence for the ontological, empirical, neural, or contemplative readings of the source paper, and no claim crosses that boundary.",
      "strong_verbs": [],
      "unscoped_strong_claim": false
    },
    {
      "allowed": true,
      "blocked_domain_risky": false,
      "blocked_domains": [
        "awakening",
        "realization",
        "clinical",
        "neural"
      ],
      "claim_target_terms": [
        "software",
        "model",
        "evidence",
        "compassion",
        "practice",
        "boundary"
      ],
      "file": "docs/manuscript/sections/conclusion/evidence_ceiling.md",
      "has_boundary_scope": true,
      "has_negation": false,
      "no_self_risky": false,
      "sentence": "Four evidence classes remain explicitly outside the current software boundary: a physical realization of the quantum free-energy principle, human-subject validation of the modeled dynamics, clinical or awakening outcomes including compassion efficacy and neural measurement, and the efficacy or safety of any user-facing contemplative practice.",
      "strong_verbs": [],
      "unscoped_strong_claim": false
    },
    {
      "allowed": true,
      "blocked_domain_risky": false,
      "blocked_domains": [],
      "claim_target_terms": [
        "software",
        "surrogate",
        "claim",
        "evidence",
        "boundary"
      ],
      "file": "docs/manuscript/sections/conclusion/limitations.md",
      "has_boundary_scope": true,
      "has_negation": true,
      "no_self_risky": false,
      "sentence": "Read together, the finite surrogates, the validated software contributions, and the uncrossed evidence boundary make this a platform on which those stronger tests can be built without quietly inheriting claims they have not yet earned.",
      "strong_verbs": [
        "validated"
      ],
      "unscoped_strong_claim": false
    },
    {
      "allowed": true,
      "blocked_domain_risky": false,
      "blocked_domains": [],
      "claim_target_terms": [
        "software",
        "model",
        "claim",
        "evidence"
      ],
      "file": "docs/manuscript/sections/conclusion/limitations.md",
      "has_boundary_scope": true,
      "has_negation": false,
      "no_self_risky": false,
      "sentence": "It recapitulates a source argument in software, validates finite model behavior under negative controls, and names the evidence still missing for stronger claims.",
      "strong_verbs": [
        "validates"
      ],
      "unscoped_strong_claim": false
    },
    {
      "allowed": true,
      "blocked_domain_risky": false,
      "blocked_domains": [
        "clinical",
        "neural"
      ],
      "claim_target_terms": [
        "artifact",
        "model",
        "practice"
      ],
      "file": "docs/manuscript/sections/conclusion/limitations.md",
      "has_boundary_scope": false,
      "has_negation": false,
      "no_self_risky": false,
      "sentence": "A future physical model, human dataset, clinical study, neural measurement, or practice interface can plug into this structure only by adding artifacts and gates that can fail.",
      "strong_verbs": [],
      "unscoped_strong_claim": false
    },
    {
      "allowed": true,
      "blocked_domain_risky": false,
      "blocked_domains": [],
      "claim_target_terms": [
        "model",
        "evidence",
        "qrf",
        "boundary"
      ],
      "file": "docs/manuscript/sections/conclusion/paper_source.md",
      "has_boundary_scope": true,
      "has_negation": false,
      "no_self_risky": false,
      "sentence": "It defines the boundary screen, shows how QRF labels can reorganize the same bits, checks that admissible relabelings preserve the finite evidence object, measures when the separation prior becomes predictively useful, tests when Bayesian model reduction makes the prior dispensable, and then replays the profiles through explicit active-inference arrays.",
      "strong_verbs": [
        "shows"
      ],
      "unscoped_strong_claim": false
    },
    {
      "allowed": true,
      "blocked_domain_risky": false,
      "blocked_domains": [],
      "claim_target_terms": [
        "software",
        "claim",
        "self"
      ],
      "file": "docs/manuscript/sections/conclusion/paper_source.md",
      "has_boundary_scope": true,
      "has_negation": true,
      "no_self_risky": false,
      "sentence": "The claim is not that the software proves emptiness, removes a self, or realizes a physical quantum free-energy principle.",
      "strong_verbs": [
        "proves"
      ],
      "unscoped_strong_claim": false
    },
    {
      "allowed": true,
      "blocked_domain_risky": false,
      "blocked_domains": [],
      "claim_target_terms": [
        "evidence",
        "criticality"
      ],
      "file": "docs/manuscript/sections/discussion/criticality.md",
      "has_boundary_scope": false,
      "has_negation": true,
      "no_self_risky": false,
      "sentence": "Power-law-like avalanche summaries would not by themselves establish criticality, because similar scaling can arise without a critical state and cortical-criticality evidence remains method-sensitive [@touboul2017power_law_absence_criticality; @destexhe2021criticality_evidence].",
      "strong_verbs": [
        "establish"
      ],
      "unscoped_strong_claim": false
    },
    {
      "allowed": true,
      "blocked_domain_risky": false,
      "blocked_domains": [
        "clinical",
        "neural"
      ],
      "claim_target_terms": [
        "software",
        "audit",
        "result",
        "results",
        "practice"
      ],
      "file": "docs/manuscript/sections/discussion/evidence_ceiling.md",
      "has_boundary_scope": true,
      "has_negation": false,
      "no_self_risky": false,
      "sentence": "The finite quantum scope summary in @sec:results-finite-quantum-scope and the technical supplement in @sec:supplement-finite-quantum-contextuality-audits can strengthen finite software checks while this section keeps physical, empirical, neural, clinical, and practice-efficacy readings blocked.",
      "strong_verbs": [],
      "unscoped_strong_claim": false
    },
    {
      "allowed": true,
      "blocked_domain_risky": false,
      "blocked_domains": [],
      "claim_target_terms": [
        "software",
        "model",
        "qrf",
        "bmr"
      ],
      "file": "docs/manuscript/sections/discussion/evidence_ceiling.md",
      "has_boundary_scope": true,
      "has_negation": false,
      "no_self_risky": false,
      "sentence": "The software can show that changing QRF labels over the same b0-b5 bitstream changes model organization, policy preferences, and BMR pruning decisions under declared priors.",
      "strong_verbs": [